{
  "$schema": "https://json-schema.org/draft/2020-12/schema",
  "$id": "https://whiteravens20.github.io/raven-packs/pack.schema.json",
  "title": "Raven Packs pack definition",
  "description": "Source of truth for one modpack. See docs/AUTHORING.md.",
  "type": "object",
  "required": ["slug", "name", "version", "minecraft", "loader"],
  "additionalProperties": false,
  "properties": {
    "$schema": { "type": "string" },
    "slug": {
      "type": "string",
      "pattern": "^[a-z0-9][a-z0-9-]*$",
      "description": "Must match the containing directory name; used in URLs and filenames."
    },
    "name": { "type": "string", "minLength": 1 },
    "version": {
      "type": "string",
      "pattern": "^\\d+\\.\\d+\\.\\d+(-[0-9A-Za-z.-]+)?$",
      "description": "Semver. Bump on every release."
    },
    "summary": {
      "description": "One line describing the pack. A plain string is taken as English; a { locale: text } map lets the launcher show it in the language the player picked. Give \"en\" whenever you give a map — it is what the .mrpack carries to other launchers.",
      "oneOf": [
        { "type": "string" },
        {
          "type": "object",
          "required": ["en"],
          "minProperties": 1,
          "propertyNames": { "pattern": "^[a-z]{2}(-[A-Z]{2})?$" },
          "additionalProperties": { "type": "string", "minLength": 1 }
        }
      ]
    },
    "author": { "type": "string" },
    "unlisted": {
      "type": "boolean",
      "description": "Keep this pack out of a build that was not asked for it by name. A pack still in development is validated and locked like any other, but must not reach dist/ — the site deploy replaces the whole catalogue, so a pack that lands there is offered by the launcher to everyone. Naming the slug on the command line overrides this, which is how it is built for testing and how it is released when it is ready."
    },
    "minecraft": {
      "type": "string",
      "minLength": 1,
      "description": "Exact Minecraft version, e.g. \"26.2\"."
    },
    "loader": {
      "type": "object",
      "required": ["type", "version"],
      "additionalProperties": false,
      "properties": {
        "type": { "enum": ["fabric", "quilt", "forge", "neoforge"] },
        "version": {
          "type": "string",
          "description": "Pin it — an unpinned loader makes builds irreproducible."
        }
      }
    },
    "recommendedRamMb": { "type": "integer", "minimum": 1024 },
    "server": {
      "type": "object",
      "additionalProperties": false,
      "properties": {
        "ip": { "type": "string" },
        "port": { "type": "integer", "minimum": 1, "maximum": 65535 }
      }
    },
    "serverListName": {
      "type": "string",
      "minLength": 1,
      "description": "Name shown in Minecraft's multiplayer list; takes section-sign formatting codes. Defaults to `name`."
    },
    "mods": { "$ref": "#/$defs/entryList" },
    "resourcePacks": { "$ref": "#/$defs/entryList" },
    "shaders": { "$ref": "#/$defs/entryList" }
  },
  "$defs": {
    "entryList": {
      "type": "array",
      "items": { "$ref": "#/$defs/entry" }
    },
    "entry": {
      "type": "object",
      "additionalProperties": false,
      "oneOf": [
        { "required": ["slug"] },
        { "required": ["url"] }
      ],
      "properties": {
        "slug": {
          "type": "string",
          "description": "Modrinth project slug or ID."
        },
        "url": {
          "type": "string",
          "format": "uri",
          "description": "Direct download URL, for content Modrinth does not host."
        },
        "version": {
          "type": "string",
          "description": "Pin a version. Matches Modrinth version_number, then version id. Omit for the newest stable release."
        },
        "allowPrerelease": {
          "type": "boolean",
          "default": false,
          "description": "Permit alpha/beta releases when resolving unpinned entries."
        },
        "id": {
          "type": "string",
          "description": "Stable identifier for URL entries; defaults to the filename."
        },
        "name": { "type": "string", "description": "Display name for URL entries." },
        "filename": { "type": "string", "description": "Override the derived filename for URL entries." },
        "ignoreDependencies": {
          "type": "array",
          "items": { "type": "string" },
          "description": "Modrinth slugs to drop from this entry's required-dependency list. A multiloader project publishes one version for every loader it supports and Modrinth has no per-loader dependency granularity, so an entry can list a dependency that is real on one loader and absent on another. Use sparingly, and only after reading the jar."
        },
        "side": {
          "enum": ["client", "server", "both"],
          "description": "Which pack(s) this belongs in. Omit to infer from Modrinth's client_side/server_side; set explicitly when the inference is wrong (e.g. a minimap marked server-optional)."
        },
        "reason": {
          "type": "string",
          "description": "Why this is in the pack. Ignored by the build; read by humans later."
        }
      }
    }
  }
}
