{
  "$schema": "../../docs/pack.schema.json",
  "slug": "sample-forge",
  "name": "Sample Forge Pack",
  "version": "0.1.0",
  "summary": {
    "pl": "Mała paczka do sprawdzania launchera na Forge'u: kilka modów, shader, paczka zasobów i plik ustawień.",
    "en": "A small pack for trying the launcher on Forge: a few mods, a shader, a resource pack and a settings file."
  },
  "author": "White Ravens",
  "unlisted": true,
  "minecraft": "1.20.1",
  "loader": {
    "type": "forge",
    "version": "47.4.10"
  },
  "recommendedRamMb": 4096,
  "mods": [
    { "slug": "embeddium", "reason": "Renderer, and required by Oculus" },
    { "slug": "oculus", "reason": "Shader loader on Forge — what makes the shader below something the game reads" },
    { "slug": "jei", "reason": "Recipe viewer. Ships to both sides" },
    { "slug": "jade", "side": "client", "reason": "Block and entity tooltip. Pinned client: nothing for a server to do" },
    { "slug": "ferrite-core", "reason": "Memory use" },
    { "slug": "clumps", "reason": "Experience orbs merged into one — the smallest mod with something for a server to do" },
    { "slug": "appleskin", "reason": "Hunger and saturation on the HUD" },
    { "slug": "mouse-tweaks", "reason": "Inventory dragging. Client only by Modrinth's own account, which is the side inference this pack leaves alone" }
  ],
  "resourcePacks": [
    { "slug": "fast-better-grass", "reason": "Ten kilobytes, and visible at a glance: grass that covers the sides of its block" }
  ],
  "shaders": [
    { "slug": "complementary-reimagined", "reason": "Half a megabyte, and the pack most players reach for first" }
  ]
}
